,title,title_detail,summary,summary_detail,links,id,guidislink,tags,published,published_parsed,content
0,Peking treibt - noch - die Kurse: Ist China wichtiger für den DAX als Deutschland?,"{'type': 'text/plain', 'language': None, 'base': 'https://www.n-tv.de/wirtschaft/rss', 'value': 'Peking treibt - noch - die Kurse: Ist China wichtiger für den DAX als Deutschland?'}","Von der deutschen Konjunktur kommen seit Längerem hauptsächlich schlechte Nachrichten. Den DAX schert das wenig. Jüngst waren es Meldungen aus China, die den Index auf ein Rekordhoch trieben. Kapitalmarktstratege Philipp Vorndran erklärt, warum China anders als Deutschland ein ""Swingfaktor"" für den Markt ist.","{'type': 'text/html', 'language': None, 'base': 'https://www.n-tv.de/wirtschaft/rss', 'value': 'Von der deutschen Konjunktur kommen seit Längerem hauptsächlich schlechte Nachrichten. Den DAX schert das wenig. Jüngst waren es Meldungen aus China, die den Index auf ein Rekordhoch trieben. Kapitalmarktstratege Philipp Vorndran erklärt, warum China anders als Deutschland ein ""Swingfaktor"" für den Markt ist.'}","[{'rel': 'alternate', 'type': 'text/html', 'href': 'https://www.n-tv.de/wirtschaft/Ist-China-wichtiger-fuer-den-DAX-als-Deutschland-article25263657.html'}, {'length': '12555', 'type': 'image/jpeg', 'href': 'https://bilder4.n-tv.de/img/incoming/crop25264115/6768671953-cImg_4_3-w250/imago0624696531h.jpg', 'rel': 'enclosure'}]",https://www.n-tv.de/wirtschaft/Ist-China-wichtiger-fuer-den-DAX-als-Deutschland-article25263657.html,False,"[{'term': 'Wirtschaft', 'scheme': None, 'label': None}]","Mon, 07 Oct 2024 16:30:33 +0200","time.struct_time(tm_year=2024, tm_mon=10, tm_mday=7, tm_hour=14, tm_min=30, tm_sec=33, tm_wday=0, tm_yday=281, tm_isdst=0)","[{'type': 'text/html', 'language': None, 'base': 'https://www.n-tv.de/wirtschaft/rss', 'value': '<img align=""left"" height=""188"" src=""https://bilder4.n-tv.de/img/incoming/crop25264115/6768671953-cImg_4_3-w250/imago0624696531h.jpg"" width=""250"" />Von der deutschen Konjunktur kommen seit Längerem hauptsächlich schlechte Nachrichten. Den DAX schert das wenig. Jüngst waren es Meldungen aus China, die den Index auf ein Rekordhoch trieben. Kapitalmarktstratege Philipp Vorndran erklärt, warum China anders als Deutschland ein &#034;Swingfaktor&#034; für den Markt ist.'}]"
1,Trotz zunehmender Beschäftigung: Bundesweit droht steigende Arbeitslosenquote,"{'type': 'text/plain', 'language': None, 'base': 'https://www.n-tv.de/wirtschaft/rss', 'value': 'Trotz zunehmender Beschäftigung: Bundesweit droht steigende Arbeitslosenquote'}",Auf dem Arbeitsmarkt droht in Deutschland eine Flaute. Im nächsten Jahr könnte laut einer Studie sowohl im Osten als auch im Westen die Arbeitslosenquote steigen. Auch ein wirtschaftsstarkes Bundesland im Süden wäre betroffen.,"{'type': 'text/html', 'language': None, 'base': 'https://www.n-tv.de/wirtschaft/rss', 'value': 'Auf dem Arbeitsmarkt droht in Deutschland eine Flaute. Im nächsten Jahr könnte laut einer Studie sowohl im Osten als auch im Westen die Arbeitslosenquote steigen. Auch ein wirtschaftsstarkes Bundesland im Süden wäre betroffen.'}","[{'rel': 'alternate', 'type': 'text/html', 'href': 'https://www.n-tv.de/wirtschaft/Bundesweit-droht-steigende-Arbeitslosenquote-article25274953.html'}, {'length': '12555', 'type': 'image/jpeg', 'href': 'https://bilder2.n-tv.de/img/incoming/crop25274945/529867984-cImg_4_3-w250/478176718.jpg', 'rel': 'enclosure'}]",https://www.n-tv.de/wirtschaft/Bundesweit-droht-steigende-Arbeitslosenquote-article25274953.html,False,"[{'term': 'Wirtschaft', 'scheme': None, 'label': None}]","Mon, 07 Oct 2024 15:54:07 +0200","time.struct_time(tm_year=2024, tm_mon=10, tm_mday=7, tm_hour=13, tm_min=54, tm_sec=7, tm_wday=0, tm_yday=281, tm_isdst=0)","[{'type': 'text/html', 'language': None, 'base': 'https://www.n-tv.de/wirtschaft/rss', 'value': '<img align=""left"" height=""188"" src=""https://bilder2.n-tv.de/img/incoming/crop25274945/529867984-cImg_4_3-w250/478176718.jpg"" width=""250"" />Auf dem Arbeitsmarkt droht in Deutschland eine Flaute. Im nächsten Jahr könnte laut einer Studie sowohl im Osten als auch im Westen die Arbeitslosenquote steigen. Auch ein wirtschaftsstarkes Bundesland im Süden wäre betroffen.'}]"
2,Ausverkauf der Wirtschaft?: Deutsche Firmen werden Übernahmekandidaten,"{'type': 'text/plain', 'language': None, 'base': 'https://www.n-tv.de/wirtschaft/rss', 'value': 'Ausverkauf der Wirtschaft?: Deutsche Firmen werden Übernahmekandidaten'}","Während sich Deutschland in der Rezession verfängt, bekommen ausländische Investoren zunehmend Lust auf heimische Firmen. Wenn die Politik Substanzverlagerung vermeiden will, muss sie schnell handeln.","{'type': 'text/html', 'language': None, 'base': 'https://www.n-tv.de/wirtschaft/rss', 'value': 'Während sich Deutschland in der Rezession verfängt, bekommen ausländische Investoren zunehmend Lust auf heimische Firmen. Wenn die Politik Substanzverlagerung vermeiden will, muss sie schnell handeln.'}","[{'rel': 'alternate', 'type': 'text/html', 'href': 'https://www.n-tv.de/wirtschaft/kommentare/Deutsche-Firmen-werden-Ubernahmekandidaten-article25274095.html'}, {'length': '12555', 'type': 'image/jpeg', 'href': 'https://bilder1.n-tv.de/img/incoming/crop25274148/1878679675-cImg_4_3-w250/486322346.jpg', 'rel': 'enclosure'}]",https://www.n-tv.de/wirtschaft/kommentare/Deutsche-Firmen-werden-Ubernahmekandidaten-article25274095.html,False,"[{'term': 'Wirtschaft', 'scheme': None, 'label': None}]","Mon, 07 Oct 2024 12:22:48 +0200","time.struct_time(tm_year=2024, tm_mon=10, tm_mday=7, tm_hour=10, tm_min=22, tm_sec=48, tm_wday=0, tm_yday=281, tm_isdst=0)","[{'type': 'text/html', 'language': None, 'base': 'https://www.n-tv.de/wirtschaft/rss', 'value': '<img align=""left"" height=""188"" src=""https://bilder1.n-tv.de/img/incoming/crop25274148/1878679675-cImg_4_3-w250/486322346.jpg"" width=""250"" />Während sich Deutschland in der Rezession verfängt, bekommen ausländische Investoren zunehmend Lust auf heimische Firmen. Wenn die Politik Substanzverlagerung vermeiden will, muss sie schnell handeln.'}]"
3,"Umbau in Gefahr: Thyssenkrupp überprüft Pläne zu ""grünem Stahl""","{'type': 'text/plain', 'language': None, 'base': 'https://www.n-tv.de/wirtschaft/rss', 'value': 'Umbau in Gefahr: Thyssenkrupp überprüft Pläne zu ""grünem Stahl""'}","Energieintensive Industrien auf klimaneutrale Produktion umzustellen, wäre ein wichtiger Beitrag zur Erreichung der deutschen Klimaziele. Thyssenkrupp geht mit Staatshilfe voran. Doch angesichts der Krise nimmt der Stahlriese die Pläne dafür noch einmal unter die Lupe.","{'type': 'text/html', 'language': None, 'base': 'https://www.n-tv.de/wirtschaft/rss', 'value': 'Energieintensive Industrien auf klimaneutrale Produktion umzustellen, wäre ein wichtiger Beitrag zur Erreichung der deutschen Klimaziele. Thyssenkrupp geht mit Staatshilfe voran. Doch angesichts der Krise nimmt der Stahlriese die Pläne dafür noch einmal unter die Lupe.'}","[{'rel': 'alternate', 'type': 'text/html', 'href': 'https://www.n-tv.de/wirtschaft/Thyssenkrupp-ueberprueft-Plaene-zu-gruenem-Stahl-article25274116.html'}, {'length': '12555', 'type': 'image/jpeg', 'href': 'https://bilder2.n-tv.de/img/incoming/crop3324701/9218673854-cImg_4_3-w250/stahl.jpg', 'rel': 'enclosure'}]",https://www.n-tv.de/wirtschaft/Thyssenkrupp-ueberprueft-Plaene-zu-gruenem-Stahl-article25274116.html,False,"[{'term': 'Wirtschaft', 'scheme': None, 'label': None}]","Mon, 07 Oct 2024 12:09:17 +0200","time.struct_time(tm_year=2024, tm_mon=10, tm_mday=7, tm_hour=10, tm_min=9, tm_sec=17, tm_wday=0, tm_yday=281, tm_isdst=0)","[{'type': 'text/html', 'language': None, 'base': 'https://www.n-tv.de/wirtschaft/rss', 'value': '<img align=""left"" height=""188"" src=""https://bilder2.n-tv.de/img/incoming/crop3324701/9218673854-cImg_4_3-w250/stahl.jpg"" width=""250"" />Energieintensive Industrien auf klimaneutrale Produktion umzustellen, wäre ein wichtiger Beitrag zur Erreichung der deutschen Klimaziele. Thyssenkrupp geht mit Staatshilfe voran. Doch angesichts der Krise nimmt der Stahlriese die Pläne dafür noch einmal unter die Lupe.'}]"
4,"Umsatzminus von 4,7 Prozent: Deutsche Autobranche lässt im ersten Halbjahr Federn","{'type': 'text/plain', 'language': None, 'base': 'https://www.n-tv.de/wirtschaft/rss', 'value': 'Umsatzminus von 4,7 Prozent: Deutsche Autobranche lässt im ersten Halbjahr Federn'}","VW, Mercedes, BMW - reihenweise kassieren deutsche Autobauer ihre Umsatzziele. Zahlen liefert nun das Statistische Bundesamt: In den ersten sechs Monaten kamen 4,7 Prozent weniger Erlöse in die Kassen.","{'type': 'text/html', 'language': None, 'base': 'https://www.n-tv.de/wirtschaft/rss', 'value': 'VW, Mercedes, BMW - reihenweise kassieren deutsche Autobauer ihre Umsatzziele. Zahlen liefert nun das Statistische Bundesamt: In den ersten sechs Monaten kamen 4,7 Prozent weniger Erlöse in die Kassen.'}","[{'rel': 'alternate', 'type': 'text/html', 'href': 'https://www.n-tv.de/wirtschaft/Deutsche-Autobranche-laesst-im-ersten-Halbjahr-Federn-article25273905.html'}, {'length': '12555', 'type': 'image/jpeg', 'href': 'https://bilder1.n-tv.de/img/incoming/crop25273912/0588675004-cImg_4_3-w250/484683349.jpg', 'rel': 'enclosure'}]",https://www.n-tv.de/wirtschaft/Deutsche-Autobranche-laesst-im-ersten-Halbjahr-Federn-article25273905.html,False,"[{'term': 'Wirtschaft', 'scheme': None, 'label': None}]","Mon, 07 Oct 2024 10:52:19 +0200","time.struct_time(tm_year=2024, tm_mon=10, tm_mday=7, tm_hour=8, tm_min=52, tm_sec=19, tm_wday=0, tm_yday=281, tm_isdst=0)","[{'type': 'text/html', 'language': None, 'base': 'https://www.n-tv.de/wirtschaft/rss', 'value': '<img align=""left"" height=""188"" src=""https://bilder1.n-tv.de/img/incoming/crop25273912/0588675004-cImg_4_3-w250/484683349.jpg"" width=""250"" />VW, Mercedes, BMW - reihenweise kassieren deutsche Autobauer ihre Umsatzziele. Zahlen liefert nun das Statistische Bundesamt: In den ersten sechs Monaten kamen 4,7 Prozent weniger Erlöse in die Kassen.'}]"
5,"""Fühlt sich wie Rezession an"": Industrieaufträge brechen nach kurzem Hoch massiv ein","{'type': 'text/plain', 'language': None, 'base': 'https://www.n-tv.de/wirtschaft/rss', 'value': '""Fühlt sich wie Rezession an"": Industrieaufträge brechen nach kurzem Hoch massiv ein'}","Deutschland ist ein Industrieland. Und in diesem Sektor sieht es derzeit mies aus. Im August sind die Bestellungen um fast sechs Prozent zurückgegangen, auch die Schlüsselbranchen Automobil, Chemie und Maschinenbau sind betroffen. Beobachter werten dies als weiteres Alarmzeichen.","{'type': 'text/html', 'language': None, 'base': 'https://www.n-tv.de/wirtschaft/rss', 'value': 'Deutschland ist ein Industrieland. Und in diesem Sektor sieht es derzeit mies aus. Im August sind die Bestellungen um fast sechs Prozent zurückgegangen, auch die Schlüsselbranchen Automobil, Chemie und Maschinenbau sind betroffen. Beobachter werten dies als weiteres Alarmzeichen.'}","[{'rel': 'alternate', 'type': 'text/html', 'href': 'https://www.n-tv.de/wirtschaft/Industrieauftraege-brechen-nach-kurzem-Hoch-massiv-ein-article25273869.html'}, {'length': '12555', 'type': 'image/jpeg', 'href': 'https://bilder4.n-tv.de/img/incoming/crop25273879/1958678598-cImg_4_3-w250/aff089e56bae3e062f2594fb0225e252.jpg', 'rel': 'enclosure'}]",https://www.n-tv.de/wirtschaft/Industrieauftraege-brechen-nach-kurzem-Hoch-massiv-ein-article25273869.html,False,"[{'term': 'Wirtschaft', 'scheme': None, 'label': None}]","Mon, 07 Oct 2024 10:51:04 +0200","time.struct_time(tm_year=2024, tm_mon=10, tm_mday=7, tm_hour=8, tm_min=51, tm_sec=4, tm_wday=0, tm_yday=281, tm_isdst=0)","[{'type': 'text/html', 'language': None, 'base': 'https://www.n-tv.de/wirtschaft/rss', 'value': '<img align=""left"" height=""188"" src=""https://bilder4.n-tv.de/img/incoming/crop25273879/1958678598-cImg_4_3-w250/aff089e56bae3e062f2594fb0225e252.jpg"" width=""250"" />Deutschland ist ein Industrieland. Und in diesem Sektor sieht es derzeit mies aus. Im August sind die Bestellungen um fast sechs Prozent zurückgegangen, auch die Schlüsselbranchen Automobil, Chemie und Maschinenbau sind betroffen. Beobachter werten dies als weiteres Alarmzeichen.'}]"
6,"Gespräche über ""Notoperation"": Pflegeversicherung droht Pleite - und Erhöhung der Beiträge","{'type': 'text/plain', 'language': None, 'base': 'https://www.n-tv.de/wirtschaft/rss', 'value': 'Gespräche über ""Notoperation"": Pflegeversicherung droht Pleite - und Erhöhung der Beiträge'}","Die gesetzliche Pflegeversicherung ist immer wieder unterfinanziert. Derzeit scheint die Lage aber katastrophal. Der bereits prognostizierte Zusatzbeitrag von 0,2 Prozentpunkten reicht einem Bericht zufolge nicht aus. Eine weitere Erhöhung droht.","{'type': 'text/html', 'language': None, 'base': 'https://www.n-tv.de/wirtschaft/rss', 'value': 'Die gesetzliche Pflegeversicherung ist immer wieder unterfinanziert. Derzeit scheint die Lage aber katastrophal. Der bereits prognostizierte Zusatzbeitrag von 0,2 Prozentpunkten reicht einem Bericht zufolge nicht aus. Eine weitere Erhöhung droht.'}","[{'rel': 'alternate', 'type': 'text/html', 'href': 'https://www.n-tv.de/wirtschaft/Pflegeversicherung-droht-Pleite-und-Erhoehung-der-Beitraege-article25273268.html'}, {'length': '12555', 'type': 'image/jpeg', 'href': 'https://bilder4.n-tv.de/img/Bilder_dpa_Import/crop25140171/4558674286-cImg_4_3-w250/Der-Sozialverband-VdK-fordert-eine-Reform-des-Sozialstaats.jpg', 'rel': 'enclosure'}]",https://www.n-tv.de/wirtschaft/Pflegeversicherung-droht-Pleite-und-Erhoehung-der-Beitraege-article25273268.html,False,"[{'term': 'Wirtschaft', 'scheme': None, 'label': None}]","Mon, 07 Oct 2024 03:01:26 +0200","time.struct_time(tm_year=2024, tm_mon=10, tm_mday=7, tm_hour=1, tm_min=1, tm_sec=26, tm_wday=0, tm_yday=281, tm_isdst=0)","[{'type': 'text/html', 'language': None, 'base': 'https://www.n-tv.de/wirtschaft/rss', 'value': '<img align=""left"" height=""188"" src=""https://bilder4.n-tv.de/img/Bilder_dpa_Import/crop25140171/4558674286-cImg_4_3-w250/Der-Sozialverband-VdK-fordert-eine-Reform-des-Sozialstaats.jpg"" width=""250"" />Die gesetzliche Pflegeversicherung ist immer wieder unterfinanziert. Derzeit scheint die Lage aber katastrophal. Der bereits prognostizierte Zusatzbeitrag von 0,2 Prozentpunkten reicht einem Bericht zufolge nicht aus. Eine weitere Erhöhung droht.'}]"
7,Massive Angriffe aus Russland: Schwarz-Gruppe berichtet von 350.000 Hacker-Attacken täglich,"{'type': 'text/plain', 'language': None, 'base': 'https://www.n-tv.de/wirtschaft/rss', 'value': 'Massive Angriffe aus Russland: Schwarz-Gruppe berichtet von 350.000 Hacker-Attacken täglich'}","Hacker greifen nicht nur Regierungen oder Behörden an, auch Unternehmen sind immer wieder ihr Ziel. Das betrifft auch die Schwarz-Gruppe in Deutschland. Die Lidl- und Kaufland-Besitzer sehen vor allem Russen hinter Hunderttausenden Attacken täglich. Eine Lösung sei aber auf dem Weg, sagt Konzernchef Chrzanowski.","{'type': 'text/html', 'language': None, 'base': 'https://www.n-tv.de/wirtschaft/rss', 'value': 'Hacker greifen nicht nur Regierungen oder Behörden an, auch Unternehmen sind immer wieder ihr Ziel. Das betrifft auch die Schwarz-Gruppe in Deutschland. Die Lidl- und Kaufland-Besitzer sehen vor allem Russen hinter Hunderttausenden Attacken täglich. Eine Lösung sei aber auf dem Weg, sagt Konzernchef Chrzanowski.'}","[{'rel': 'alternate', 'type': 'text/html', 'href': 'https://www.n-tv.de/wirtschaft/Schwarz-Gruppe-berichtet-von-350-000-Hacker-Attacken-taeglich-article25273249.html'}, {'length': '12555', 'type': 'image/jpeg', 'href': 'https://bilder1.n-tv.de/img/incoming/crop25273248/6418675022-cImg_4_3-w250/482722450.jpg', 'rel': 'enclosure'}]",https://www.n-tv.de/wirtschaft/Schwarz-Gruppe-berichtet-von-350-000-Hacker-Attacken-taeglich-article25273249.html,False,"[{'term': 'Wirtschaft', 'scheme': None, 'label': None}]","Mon, 07 Oct 2024 00:43:05 +0200","time.struct_time(tm_year=2024, tm_mon=10, tm_mday=6, tm_hour=22, tm_min=43, tm_sec=5, tm_wday=6, tm_yday=280, tm_isdst=0)","[{'type': 'text/html', 'language': None, 'base': 'https://www.n-tv.de/wirtschaft/rss', 'value': '<img align=""left"" height=""188"" src=""https://bilder1.n-tv.de/img/incoming/crop25273248/6418675022-cImg_4_3-w250/482722450.jpg"" width=""250"" />Hacker greifen nicht nur Regierungen oder Behörden an, auch Unternehmen sind immer wieder ihr Ziel. Das betrifft auch die Schwarz-Gruppe in Deutschland. Die Lidl- und Kaufland-Besitzer sehen vor allem Russen hinter Hunderttausenden Attacken täglich. Eine Lösung sei aber auf dem Weg, sagt Konzernchef Chrzanowski.'}]"
8,Großprojekt Koralmbahn: Kärnten: Neuer Wirtschaftsraum im Wachstum,"{'type': 'text/plain', 'language': None, 'base': 'https://www.n-tv.de/wirtschaft/rss', 'value': 'Großprojekt Koralmbahn: Kärnten: Neuer Wirtschaftsraum im Wachstum'}","Statt wie bisher um die Berge herum fährt die Bahn in Kärnten künftig mitten durch das Bergmassiv der Koralpe. Die Auswirkungen der neuen Koralmbahn sind gewaltig – nicht nur im Bereich der Logistik. Wie sich der Wirtschaftsraum verändern wird, hat eine breit angelegte und umfassende Standortstudie untersucht.","{'type': 'text/html', 'language': None, 'base': 'https://www.n-tv.de/wirtschaft/rss', 'value': 'Statt wie bisher um die Berge herum fährt die Bahn in Kärnten künftig mitten durch das Bergmassiv der Koralpe. Die Auswirkungen der neuen Koralmbahn sind gewaltig – nicht nur im Bereich der Logistik. Wie sich der Wirtschaftsraum verändern wird, hat eine breit angelegte und umfassende Standortstudie untersucht.'}","[{'rel': 'alternate', 'type': 'text/html', 'href': 'https://www.n-tv.de/wirtschaft/kaernten_schafft_gruene_ki_zukunft/Grossprojekt-Koralmbahn-Wie-die-Koralmbahn-in-Kaernten-alles-veraendert-article25201840.html'}, {'length': '12555', 'type': 'image/jpeg', 'href': 'https://bilder3.n-tv.de/img/incoming/crop25201878/5108671008-cImg_4_3-w250/Der-neue-Streckenverlauf-der-Bahn-in-Karnten-fuhrt-mitten-durchs-Bergmassiv-der-Koralpe.jpg', 'rel': 'enclosure'}]",https://www.n-tv.de/wirtschaft/kaernten_schafft_gruene_ki_zukunft/Grossprojekt-Koralmbahn-Wie-die-Koralmbahn-in-Kaernten-alles-veraendert-article25201840.html,False,"[{'term': 'Wirtschaft', 'scheme': None, 'label': None}]","Mon, 07 Oct 2024 00:01:00 +0200","time.struct_time(tm_year=2024, tm_mon=10, tm_mday=6, tm_hour=22, tm_min=1, tm_sec=0, tm_wday=6, tm_yday=280, tm_isdst=0)","[{'type': 'text/html', 'language': None, 'base': 'https://www.n-tv.de/wirtschaft/rss', 'value': '<img align=""left"" height=""188"" src=""https://bilder3.n-tv.de/img/incoming/crop25201878/5108671008-cImg_4_3-w250/Der-neue-Streckenverlauf-der-Bahn-in-Karnten-fuhrt-mitten-durchs-Bergmassiv-der-Koralpe.jpg"" width=""250"" />Statt wie bisher um die Berge herum fährt die Bahn in Kärnten künftig mitten durch das Bergmassiv der Koralpe. Die Auswirkungen der neuen Koralmbahn sind gewaltig – nicht nur im Bereich der Logistik. Wie sich der Wirtschaftsraum verändern wird, hat eine breit angelegte und umfassende Standortstudie untersucht.'}]"
9,Vielfältige Anwendungsgebiete: KI in der Pflege: Welche Chancen und Herausforderungen gibt es?,"{'type': 'text/plain', 'language': None, 'base': 'https://www.n-tv.de/wirtschaft/rss', 'value': 'Vielfältige Anwendungsgebiete: KI in der Pflege: Welche Chancen und Herausforderungen gibt es?'}","Was kann die künstliche Intelligenz im Bereich der Pflege leisten? Das Ziel bei vielen KI-Anwendungen ist es, mehr Zeit für die Pflege der Bewohner und eine geringere Arbeitsbelastung zu schaffen. Das verspricht zum Beispiel auch das sprachgesteuerte KI-Pflegedokumentationssystem der Firma Voize.","{'type': 'text/html', 'language': None, 'base': 'https://www.n-tv.de/wirtschaft/rss', 'value': 'Was kann die künstliche Intelligenz im Bereich der Pflege leisten? Das Ziel bei vielen KI-Anwendungen ist es, mehr Zeit für die Pflege der Bewohner und eine geringere Arbeitsbelastung zu schaffen. Das verspricht zum Beispiel auch das sprachgesteuerte KI-Pflegedokumentationssystem der Firma Voize.'}","[{'rel': 'alternate', 'type': 'text/html', 'href': 'https://www.n-tv.de/wirtschaft/kaernten_schafft_gruene_ki_zukunft/KI-in-der-Pflege-Welche-Chancen-und-Herausforderungen-gibt-es-article25215044.html'}, {'length': '12555', 'type': 'image/jpeg', 'href': 'https://bilder3.n-tv.de/img/incoming/crop25215170/8138671973-cImg_4_3-w250/Mithife-der-Voize-App-kann-die-Pflegedokumentation-frei-am-Smartphone-eingesprochen-werden.jpg', 'rel': 'enclosure'}]",https://www.n-tv.de/wirtschaft/kaernten_schafft_gruene_ki_zukunft/KI-in-der-Pflege-Welche-Chancen-und-Herausforderungen-gibt-es-article25215044.html,False,"[{'term': 'Wirtschaft', 'scheme': None, 'label': None}]","Mon, 07 Oct 2024 00:01:00 +0200","time.struct_time(tm_year=2024, tm_mon=10, tm_mday=6, tm_hour=22, tm_min=1, tm_sec=0, tm_wday=6, tm_yday=280, tm_isdst=0)","[{'type': 'text/html', 'language': None, 'base': 'https://www.n-tv.de/wirtschaft/rss', 'value': '<img align=""left"" height=""188"" src=""https://bilder3.n-tv.de/img/incoming/crop25215170/8138671973-cImg_4_3-w250/Mithife-der-Voize-App-kann-die-Pflegedokumentation-frei-am-Smartphone-eingesprochen-werden.jpg"" width=""250"" />Was kann die künstliche Intelligenz im Bereich der Pflege leisten? Das Ziel bei vielen KI-Anwendungen ist es, mehr Zeit für die Pflege der Bewohner und eine geringere Arbeitsbelastung zu schaffen. Das verspricht zum Beispiel auch das sprachgesteuerte KI-Pflegedokumentationssystem der Firma Voize.'}]"
10,Zahl der Fluggäste steigend: Klimaneutrales Fliegen: Ist das möglich?,"{'type': 'text/plain', 'language': None, 'base': 'https://www.n-tv.de/wirtschaft/rss', 'value': 'Zahl der Fluggäste steigend: Klimaneutrales Fliegen: Ist das möglich?'}","Die Zukunft der Luftfahrt soll Batteriestrom und Wasserstoff gehören. Aber wird es irgendwann wirklich möglich, beispielsweise von Frankfurt in die Karibik, ohne schlechtes Gewissen in der Luft unterwegs zu sein? Und wann könnte das der Fall sein?","{'type': 'text/html', 'language': None, 'base': 'https://www.n-tv.de/wirtschaft/rss', 'value': 'Die Zukunft der Luftfahrt soll Batteriestrom und Wasserstoff gehören. Aber wird es irgendwann wirklich möglich, beispielsweise von Frankfurt in die Karibik, ohne schlechtes Gewissen in der Luft unterwegs zu sein? Und wann könnte das der Fall sein?'}","[{'rel': 'alternate', 'type': 'text/html', 'href': 'https://www.n-tv.de/wirtschaft/kaernten_schafft_gruene_ki_zukunft/Klimaneutrales-Fliegen-Ist-das-moeglich-article25106931.html'}, {'length': '12555', 'type': 'image/jpeg', 'href': 'https://bilder2.n-tv.de/img/incoming/crop25106937/1498679944-cImg_4_3-w250/imago0473955333h.jpg', 'rel': 'enclosure'}]",https://www.n-tv.de/wirtschaft/kaernten_schafft_gruene_ki_zukunft/Klimaneutrales-Fliegen-Ist-das-moeglich-article25106931.html,False,"[{'term': 'Wirtschaft', 'scheme': None, 'label': None}]","Mon, 07 Oct 2024 00:01:00 +0200","time.struct_time(tm_year=2024, tm_mon=10, tm_mday=6, tm_hour=22, tm_min=1, tm_sec=0, tm_wday=6, tm_yday=280, tm_isdst=0)","[{'type': 'text/html', 'language': None, 'base': 'https://www.n-tv.de/wirtschaft/rss', 'value': '<img align=""left"" height=""188"" src=""https://bilder2.n-tv.de/img/incoming/crop25106937/1498679944-cImg_4_3-w250/imago0473955333h.jpg"" width=""250"" />Die Zukunft der Luftfahrt soll Batteriestrom und Wasserstoff gehören. Aber wird es irgendwann wirklich möglich, beispielsweise von Frankfurt in die Karibik, ohne schlechtes Gewissen in der Luft unterwegs zu sein? Und wann könnte das der Fall sein?'}]"
11,Hilfe beim Radeln: Kärnter Startup verwandelt Fahrräder in E-Bikes,"{'type': 'text/plain', 'language': None, 'base': 'https://www.n-tv.de/wirtschaft/rss', 'value': 'Hilfe beim Radeln: Kärnter Startup verwandelt Fahrräder in E-Bikes'}","Mit dem elektrischen Hilfsmotor des 2014 gegründeten Unternehmens GP Motion kann man sein Fahrrad schnell und einfach in ein E-Bike umwandeln. Im Interview mit ntv.de erklärt Geschäftsführer Fabian Gutbrod, was den Motor add-e so besonders macht und wie die Zukunft des Produkts aussehen soll.","{'type': 'text/html', 'language': None, 'base': 'https://www.n-tv.de/wirtschaft/rss', 'value': 'Mit dem elektrischen Hilfsmotor des 2014 gegründeten Unternehmens GP Motion kann man sein Fahrrad schnell und einfach in ein E-Bike umwandeln. Im Interview mit ntv.de erklärt Geschäftsführer Fabian Gutbrod, was den Motor add-e so besonders macht und wie die Zukunft des Produkts aussehen soll.'}","[{'rel': 'alternate', 'type': 'text/html', 'href': 'https://www.n-tv.de/wirtschaft/kaernten_schafft_gruene_ki_zukunft/Hilfe-beim-Radeln-Kaernter-Startup-verwandelt-Fahrraeder-in-E-Bikes-article25133913.html'}, {'length': '12555', 'type': 'image/jpeg', 'href': 'https://bilder2.n-tv.de/img/incoming/crop25133929/127867879-cImg_4_3-w250/imago0448569706h.jpg', 'rel': 'enclosure'}]",https://www.n-tv.de/wirtschaft/kaernten_schafft_gruene_ki_zukunft/Hilfe-beim-Radeln-Kaernter-Startup-verwandelt-Fahrraeder-in-E-Bikes-article25133913.html,False,"[{'term': 'Wirtschaft', 'scheme': None, 'label': None}]","Mon, 07 Oct 2024 00:01:00 +0200","time.struct_time(tm_year=2024, tm_mon=10, tm_mday=6, tm_hour=22, tm_min=1, tm_sec=0, tm_wday=6, tm_yday=280, tm_isdst=0)","[{'type': 'text/html', 'language': None, 'base': 'https://www.n-tv.de/wirtschaft/rss', 'value': '<img align=""left"" height=""188"" src=""https://bilder2.n-tv.de/img/incoming/crop25133929/127867879-cImg_4_3-w250/imago0448569706h.jpg"" width=""250"" />Mit dem elektrischen Hilfsmotor des 2014 gegründeten Unternehmens GP Motion kann man sein Fahrrad schnell und einfach in ein E-Bike umwandeln. Im Interview mit ntv.de erklärt Geschäftsführer Fabian Gutbrod, was den Motor add-e so besonders macht und wie die Zukunft des Produkts aussehen soll.'}]"
